{
  "bundle_version": "1.0.0",
  "created_at": "2026-03-07T03:15:00.000Z",
  "fixture_id": "deterministic-3-entry-multi-size-fixture",
  "fixture_schema": "grant-audit-transparency-log-fixture-v1",
  "log_entry_count": 3,
  "proof_count": 3,
  "proofs": [
    {
      "appended_entry_hashes": [
        "ebfba7596d47854b3cec9d294db03b9e7ba0b1681af1ad345109c1ea734c7cb9"
      ],
      "appended_entry_indexes": [
        1
      ],
      "created_at": "2026-03-07T03:15:00.000Z",
      "new_head_entry_cumulative_root": "29451d240b9863f7104e5a1b6d7cbf5dce5db287b888bbdf7b8e6c82b3ea157c",
      "new_head_entry_hash": "ebfba7596d47854b3cec9d294db03b9e7ba0b1681af1ad345109c1ea734c7cb9",
      "new_root": "29451d240b9863f7104e5a1b6d7cbf5dce5db287b888bbdf7b8e6c82b3ea157c",
      "new_size": 2,
      "old_head_entry_hash": "2a402c25cd185ffa313de1134e3c64bce17c9798a1a16db3d503a484d2819564",
      "old_root": "9e51a0e7a6152ecad4967ac3533f3c78b15377a80e9fca3d0c5fec18a1a8cec6",
      "old_size": 1,
      "old_tail_cumulative_root": "9e51a0e7a6152ecad4967ac3533f3c78b15377a80e9fca3d0c5fec18a1a8cec6",
      "old_tail_entry_hash": "2a402c25cd185ffa313de1134e3c64bce17c9798a1a16db3d503a484d2819564",
      "proof_version": "1.0.0",
      "schema": "grant-audit-transparency-log-consistency-proof-v1"
    },
    {
      "appended_entry_hashes": [
        "ebfba7596d47854b3cec9d294db03b9e7ba0b1681af1ad345109c1ea734c7cb9",
        "c744a6230683cd53a53d97b72de5ab9d2055659c67cbba56d8ea072424f9233b"
      ],
      "appended_entry_indexes": [
        1,
        2
      ],
      "created_at": "2026-03-07T03:15:00.000Z",
      "new_head_entry_cumulative_root": "32ca104df81d6a35e4817695dd7a2e65b16afc807f30fff94a648572026b314e",
      "new_head_entry_hash": "c744a6230683cd53a53d97b72de5ab9d2055659c67cbba56d8ea072424f9233b",
      "new_root": "32ca104df81d6a35e4817695dd7a2e65b16afc807f30fff94a648572026b314e",
      "new_size": 3,
      "old_head_entry_hash": "2a402c25cd185ffa313de1134e3c64bce17c9798a1a16db3d503a484d2819564",
      "old_root": "9e51a0e7a6152ecad4967ac3533f3c78b15377a80e9fca3d0c5fec18a1a8cec6",
      "old_size": 1,
      "old_tail_cumulative_root": "9e51a0e7a6152ecad4967ac3533f3c78b15377a80e9fca3d0c5fec18a1a8cec6",
      "old_tail_entry_hash": "2a402c25cd185ffa313de1134e3c64bce17c9798a1a16db3d503a484d2819564",
      "proof_version": "1.0.0",
      "schema": "grant-audit-transparency-log-consistency-proof-v1"
    },
    {
      "appended_entry_hashes": [
        "c744a6230683cd53a53d97b72de5ab9d2055659c67cbba56d8ea072424f9233b"
      ],
      "appended_entry_indexes": [
        2
      ],
      "created_at": "2026-03-07T03:15:00.000Z",
      "new_head_entry_cumulative_root": "32ca104df81d6a35e4817695dd7a2e65b16afc807f30fff94a648572026b314e",
      "new_head_entry_hash": "c744a6230683cd53a53d97b72de5ab9d2055659c67cbba56d8ea072424f9233b",
      "new_root": "32ca104df81d6a35e4817695dd7a2e65b16afc807f30fff94a648572026b314e",
      "new_size": 3,
      "old_head_entry_hash": "ebfba7596d47854b3cec9d294db03b9e7ba0b1681af1ad345109c1ea734c7cb9",
      "old_root": "29451d240b9863f7104e5a1b6d7cbf5dce5db287b888bbdf7b8e6c82b3ea157c",
      "old_size": 2,
      "old_tail_cumulative_root": "29451d240b9863f7104e5a1b6d7cbf5dce5db287b888bbdf7b8e6c82b3ea157c",
      "old_tail_entry_hash": "ebfba7596d47854b3cec9d294db03b9e7ba0b1681af1ad345109c1ea734c7cb9",
      "proof_version": "1.0.0",
      "schema": "grant-audit-transparency-log-consistency-proof-v1"
    }
  ],
  "schema": "grant-audit-transparency-log-consistency-proof-bundle-v1"
}
